"","text","lang","created_at.x","author_id","possibly_sensitive","reply_settings","id","conversation_id","in_reply_to_user_id","location","name","protected","created_at.y","description","verified","username","profile_image_url","geo_place_id","public_metrics.x_retweet_count","public_metrics.x_reply_count","public_metrics.x_like_count","public_metrics.x_quote_count","public_metrics.x_impression_count","public_metrics.y_followers_count","public_metrics.y_following_count","public_metrics.y_tweet_count","public_metrics.y_listed_count","url","pinned_tweet_id","text_with_display_links"
"63","@CatByDesign Brevis, the single-celled organism that triggers red tide and harms sea life and humans. The algae produces a neurotoxin that, in large quantities, triggers 'fish kills' by depriving the water of necessary oxygen.. ","en",2021-07-29 23:20:53,"1190778635332009984",FALSE,"everyone","1420887079031119872","1420591583926312961","1275667582083829760","#FascistFloriduh","Gregory Thomas",FALSE,"2019-11-02T23:52:24.000Z","vigilant doubter",FALSE,"gregdemarco1964","https://pbs.twimg.com/profile_images/1190779182466445312/GKCFzApx_normal.jpg","0190556f56729d0c",2,1,2,1,0,2002,5007,70402,6,NA,NA,"@CatByDesign Brevis, the single-celled organism that triggers red tide and harms sea life and humans. The algae produces a neurotoxin that, in large quantities, triggers 'fish kills' by depriving the water of necessary oxygen."
"64","@FaneuilHall Shopping outlet mall in FloridaBeaches are filled with red tide dead  fish. ","en",2021-07-31 14:51:42,"510755849",FALSE,"everyone","1421483716447178752","1421468203058749449","76212176","Earth","spike",FALSE,"2012-03-01T19:52:36.000Z","2 meters X 137 Kg love music out door's (youtube channel) . https://t.co/XZGoTsuZGH $surferjo :cash app",FALSE,"TallGuy_007","https://pbs.twimg.com/profile_images/484370902147424257/W6mUy5si_normal.jpeg","0003df7b402165e0",0,0,0,0,0,563,520,80994,63,"https://t.co/16SXnstngR","1599199168807186432","@FaneuilHall Shopping outlet mall in FloridaBeaches are filled with red tide dead  fish"
"65","For fertizer questions go to Pasco Fertilizer Ordinance. No. 14-16.
Improper use of fertilizer causes pollution &amp; algae blooms in waterways. Professional companies are trained to apply fertilizer properly &amp; should be used.
Please take Pasco County's survey  . https   www surveymonkey com r SL8TNCJ. https   twitter com KeepPascoBu2ful status 1423009556196646914 photo 1","en",2021-08-04 19:54:51,"3170646208",FALSE,"everyone","1423009556196646914","1423009556196646914",NA,"Pasco County, FL","KeepPascoBeautiful",FALSE,"2015-04-15T17:03:55.000Z","To promote better methods to reduce litter and waste, to recycle, and to landscape and beautify our neighborhoods.",FALSE,"KeepPascoBu2ful","https://pbs.twimg.com/profile_images/588433551047049217/vldPsy1j_normal.jpg","f385a5dfa0c1d8ca",0,0,1,0,0,609,482,1486,17,"https://t.co/Lp6Es4MEqT",NA,"For fertizer questions go to Pasco Fertilizer Ordinance. No. 14-16.
Improper use of fertilizer causes pollution &amp; algae blooms in waterways. Professional companies are trained to apply fertilizer properly &amp; should be used.
Please take Pasco County's survey https://t.co/FRt4szY2K4 https://t.co/P9tTPMzL9W"
"66","@bblock29 #Worstgovernorever DeSantis has a platform of dead kids. Dead manatees and Red Tide.. ","en",2021-08-05 02:25:33,"26801457",FALSE,"everyone","1423107880773881862","1423070654014894081","1949789970","New Port Richey, FL","Ina Bobina",FALSE,"2009-03-26T17:39:38.000Z","❤️’s to wander the world, believes in the wonder of nature, Florida woman (very different from Florida man). Not all who wander are lost.",FALSE,"HappyNightOwl","https://pbs.twimg.com/profile_images/1522800177383362565/DbsdTmum_normal.jpg","00b6dd7160a5af36",0,0,1,0,0,277,1554,12102,6,NA,NA,"@bblock29 #Worstgovernorever DeSantis has a platform of dead kids. Dead manatees and Red Tide."
"67","@MardyKing1 Thank you!!! So happy that red tide is gone!. ","en",2021-08-07 15:17:37,"1472916036",FALSE,"everyone","1424026955159064577","1423809811091755013","569608187","Wesley Chapel, FL","Movin'itwithMichelle",FALSE,"2013-05-31T19:44:32.000Z","Retired Air Force MSgt, Wanna be Chef, Marathoner, Writer,  and photographer. I’d rather be at the beach-always.",FALSE,"MichelleMovinIt","https://pbs.twimg.com/profile_images/1271999192454569984/eUTV2QVu_normal.jpg","0003df7b402165e0",0,0,1,0,0,1469,1197,15585,48,"https://t.co/WXVb0NW5wt",NA,"@MardyKing1 Thank you!!! So happy that red tide is gone!"
"68","@Joseph_Rhea Probably red tide or some crazy new tide we haven't heard of b4 lol 🙄. ","en",2021-08-15 00:59:18,"1086806768863322112",FALSE,"everyone","1426710051964833799","1426654564162412549","166619933","Hudson, FL","Writer Wendy Doyle Palumbo",FALSE,"2019-01-20T02:05:00.000Z","Writer, Spiritual Badass",FALSE,"SuperWendyWoman","https://pbs.twimg.com/profile_images/1591858760569573378/44RxH7QJ_normal.jpg","0190556f56729d0c",0,0,1,0,0,4939,5117,3611,39,"https://t.co/VlUPmz1X5S","1235551353432309761","@Joseph_Rhea Probably red tide or some crazy new tide we haven't heard of b4 lol 🙄"
"69","Improper fertilizing harms water quality - polluting waterways and creating algae blooms. Pasco County’s fertilizer ordinance is designed to protect our waters. 
Please take the survey to share your thoughts on fertilizer use  . . https   www surveymonkey com r SL8TNCJ. https   twitter com KeepPascoBu2ful status 1437526597289054218 photo 1","en",2021-09-13 21:20:23,"3170646208",FALSE,"everyone","1437526597289054218","1437526597289054218",NA,"Pasco County, FL","KeepPascoBeautiful",FALSE,"2015-04-15T17:03:55.000Z","To promote better methods to reduce litter and waste, to recycle, and to landscape and beautify our neighborhoods.",FALSE,"KeepPascoBu2ful","https://pbs.twimg.com/profile_images/588433551047049217/vldPsy1j_normal.jpg","8c1a061c37aea043",1,2,1,0,0,609,482,1486,17,"https://t.co/Lp6Es4MEqT",NA,"Improper fertilizing harms water quality - polluting waterways and creating algae blooms. Pasco County’s fertilizer ordinance is designed to protect our waters. 
Please take the survey to share your thoughts on fertilizer use https://t.co/FRt4szY2K4 . https://t.co/kZrRsTcOrz"
"70","This link will take you to Pasco County's fertilizer ordinance . https   www pascocountyfl net DocumentCenter View 15999 Fertilizer Ordinance 14 16","en",2021-09-13 21:21:32,"3170646208",FALSE,"everyone","1437526887887212548","1437526597289054218","3170646208","Pasco County, FL","KeepPascoBeautiful",FALSE,"2015-04-15T17:03:55.000Z","To promote better methods to reduce litter and waste, to recycle, and to landscape and beautify our neighborhoods.",FALSE,"KeepPascoBu2ful","https://pbs.twimg.com/profile_images/588433551047049217/vldPsy1j_normal.jpg","8c1a061c37aea043",0,0,1,0,0,609,482,1486,17,"https://t.co/Lp6Es4MEqT",NA,"This link will take you to Pasco County's fertilizer ordinance https://t.co/mpxjzSjBlx"
"71","Here are tips to reduce your fertilizer use . https   www pascocountyfl net 2809 Reduce Fertilizer Usagehttps   www pascocountyfl net 2809 Reduce Fertilizer Usage","en",2021-09-13 21:22:08,"3170646208",FALSE,"everyone","1437527037900640261","1437526597289054218","3170646208","Pasco County, FL","KeepPascoBeautiful",FALSE,"2015-04-15T17:03:55.000Z","To promote better methods to reduce litter and waste, to recycle, and to landscape and beautify our neighborhoods.",FALSE,"KeepPascoBu2ful","https://pbs.twimg.com/profile_images/588433551047049217/vldPsy1j_normal.jpg","8c1a061c37aea043",0,0,1,0,0,609,482,1486,17,"https://t.co/Lp6Es4MEqT",NA,"Here are tips to reduce your fertilizer use https://t.co/Lt39loHT6j"
"72","@3rdWheelJordyn I read it was from a blue green algae that is eaten by crustaceans in shore. The big offshore ones never really have that.. ","en",2021-11-03 23:53:07,"374792308",FALSE,"everyone","1456046814738718721","1456033117920190468","268950254","Florida, USA","KSB",FALSE,"2011-09-16T23:31:06.000Z","Texas Aggie ‘93. Football, cooking, and science. AL born LA home TX Aggie IN Boiler WA-CA-FL Personal account. Follow at your own risk.",FALSE,"KSBruno9","https://pbs.twimg.com/profile_images/1537632598196899843/7wlpmrZM_normal.jpg","0003df7b402165e0",0,1,1,0,0,749,2211,52337,33,NA,"914663334548447232","@3rdWheelJordyn I read it was from a blue green algae that is eaten by crustaceans in shore. The big offshore ones never really have that."
"73","@tommychong @coralcrf @PonyoInu @elonmusk Yes They Are Growing Coral In glass tanks In Buildings. From Little Tiny Corals they are Growing them to restore reefs 
  But we Keep Losing them thar sea Cows. 
 About 900 a Year. @codeofvets 
 We put So Much Fertilizer on our Lawns Which run into the Coastline helping Red Tide. ","en",2021-11-25 00:41:33,"4916069896",FALSE,"everyone","1463669148765114370","1463664723656945668","64857767","New Port Richey, FL","LillROY Jimi Says 12",FALSE,"2016-02-15T22:07:43.000Z","Navy1981 near Azores in 80 Oct I Brought Comm. Leading to rendelshem.England Event. NJ 1963-64 on railroadTracks I met,Jimi Hendrix weTalked Greatly of UFO 👽🐦",FALSE,"SaysJimi","https://pbs.twimg.com/profile_images/1332314278695727106/_cgUI5Iu_normal.jpg","79dc2655046fbc40",0,1,9,0,0,754,913,15569,2,NA,"911278327977119744","@tommychong @coralcrf @PonyoInu @elonmusk Yes They Are Growing Coral In glass tanks In Buildings. From Little Tiny Corals they are Growing them to restore reefs 
  But we Keep Losing them thar sea Cows. 
 About 900 a Year. @codeofvets 
 We put So Much Fertilizer on our Lawns Which run into the Coastline helping Red Tide"
"74","Many manatees are dying from starvation.  They thrive on seagrass, but it is disappearing due to the increase in algae blooms, fed by residential fertilizer. To learn more, go to  .   #keeppascowatersbeautiful #fertilizerawareness . https   www keeppascobeautiful org fertilizerawareness. https   twitter com KeepPascoBu2ful status 1524049868985147393 photo 1","en",2022-05-10 15:32:58,"3170646208",FALSE,"everyone","1524049868985147393","1524049868985147393",NA,"Pasco County, FL","KeepPascoBeautiful",FALSE,"2015-04-15T17:03:55.000Z","To promote better methods to reduce litter and waste, to recycle, and to landscape and beautify our neighborhoods.",FALSE,"KeepPascoBu2ful","https://pbs.twimg.com/profile_images/588433551047049217/vldPsy1j_normal.jpg","f385a5dfa0c1d8ca",0,0,0,0,0,609,482,1486,17,"https://t.co/Lp6Es4MEqT",NA,"Many manatees are dying from starvation.  They thrive on seagrass, but it is disappearing due to the increase in algae blooms, fed by residential fertilizer. To learn more, go to https://t.co/6PzQTi1HJh .   #keeppascowatersbeautiful #fertilizerawareness https://t.co/XtUVQbJ318"
"75","@CTVLethbridge Can't just say they lost you have to say they ""narrowly lost,"" even if it was a ripple red tide it was tiny enough to boot Nancy Pelosi out of that seat.. ","en",2022-11-17 15:30:05,"44873670",FALSE,"everyone","1593265225192595456","1593264802729705472","152004319","Florida, USA","🌴Ƒℓorida ʍ๏xi 🍊☀️🌺",FALSE,"2009-06-05T11:40:32.000Z","DAR Daughter 🇺🇲 
📜Genealogy researcher 
📷 photography 
Artist🎨

You don’t walk away from a failed coup
but they succeeded.",FALSE,"Moxi_Mimi","https://pbs.twimg.com/profile_images/1606380696125276160/CTxWiQJw_normal.jpg","2d1b0aee7297f004",0,0,0,0,0,1077,137,60711,5,NA,NA,"@CTVLethbridge Can't just say they lost you have to say they ""narrowly lost,"" even if it was a ripple red tide it was tiny enough to boot Nancy Pelosi out of that seat."
