"","text","lang","author_id","reply_settings","possibly_sensitive","id","in_reply_to_user_id","created_at.x","conversation_id","description","profile_image_url","username","protected","verified","location","name","created_at.y","pinned_tweet_id","url","public_metrics.x_retweet_count","public_metrics.x_reply_count","public_metrics.x_like_count","public_metrics.x_quote_count","public_metrics.x_bookmark_count","public_metrics.x_impression_count","public_metrics.y_followers_count","public_metrics.y_following_count","public_metrics.y_tweet_count","public_metrics.y_listed_count","public_metrics.y_like_count","text_with_display_links","withheld.x_copyright","reply.to.thread.no.term"
"1","@Sassafrass_84 Unless you're in big cities. Which most big cities are democrat. Tampa has democrats major. She's worthless and cause red tide alot. But she's there.. ","en","888052752043057152","everyone",FALSE,"1775155444392083731","888052752043057152",2024-04-02 13:36:53,"1774853326036701385","What what","https://pbs.twimg.com/profile_images/1758677804248428544/QM0CFun7_normal.jpg","agroyboy1",FALSE,FALSE,"Florida, USA","Shawnr","2017-07-20T15:07:30.000Z",NA,NA,0,0,0,0,0,4,205,82,736,1,4563,"@Sassafrass_84 Unless you're in big cities. Which most big cities are democrat. Tampa has democrats major. She's worthless and cause red tide alot. But she's there.",NA,NA
"2","@MikeHudema The fish washed out because of red tide which is caused by pollution (nitrates and phosphates). Some come from Mississippi River and some from gypsum stacks in Tampa. Red tide happens every year. Although colder water in winter stops red tide, it is not the heat that is causing… . https   twitter com i web status 1774955442197668287","en","2753881899","everyone",FALSE,"1774955442197668287","15088481",2024-04-02 00:22:09,"1774774239641411896","Gen Z for freedom and self-determination","https://pbs.twimg.com/profile_images/1643468396921606144/u8bhL0JV_normal.jpg","verystrange333",FALSE,FALSE,NA,"Katie","2014-08-29T01:01:17.000Z",NA,NA,0,1,3,0,0,61,151,43,3598,0,5706,"@MikeHudema The fish washed out because of red tide which is caused by pollution (nitrates and phosphates). Some come from Mississippi River and some from gypsum stacks in Tampa. Red tide happens every year. Although colder water in winter stops red tide, it is not the heat that is causing… https://t.co/Jroo70hqzs",NA,NA
"3","🟢 Green Alert - Pasco County Health Officials Issue Blue-Green Algae Bloom Alert For Dowling Lake  Tampa Free Press . https   news google com rss articles CBMiamh0dHBzOi8vd3d3LnRhbXBhZnAuY29tL3Bhc2NvLWNvdW50eS1oZWFsdGgtb2ZmaWNpYWxzLWlzc3VlLWJsdWUtZ3JlZW4tYWxnYWUtYmxvb20tYWxlcnQtZm9yLWRvd25pbmctbGFrZS_SAQA","en","617853906","everyone",FALSE,"1774527610124710312",NA,2024-03-31 20:02:06,"1774527610124710312","Reporting fast and accurate news coverage on alerts, breaking news, weather, sports, and entertainment.","https://pbs.twimg.com/profile_images/1774190207438594048/A26mpjs1_normal.jpg","PointmanAlerts",FALSE,FALSE,"Turn on notifications ","🚨 Pointman Alerts","2012-06-25T04:38:20.000Z","1775187115527319986",NA,0,0,1,0,0,24,96220,6613,2639375,381,18251,"🟢 Green Alert - Pasco County Health Officials Issue Blue-Green Algae Bloom Alert For Dowling Lake  Tampa Free Press https://t.co/KV1AF2IQQg",NA,NA
"4","@Ashley50239771 @MoonBridgeArmy I bet that stinks. Down in Tampa they have what's called Red Tide and the same thing happens and it wreaks!. ","en","1626342140287614981","everyone",FALSE,"1774441996330861000","1416757446564003845",2024-03-31 14:21:54,"1774441524714938596","","https://pbs.twimg.com/profile_images/1759659745416298496/JwERokL9_normal.jpg","Itsallrigged17",FALSE,FALSE,"Michigan, USA","Mike","2023-02-16T22:06:22.000Z",NA,NA,0,0,1,0,0,8,1115,2820,12307,0,14509,"@Ashley50239771 @MoonBridgeArmy I bet that stinks. Down in Tampa they have what's called Red Tide and the same thing happens and it wreaks!",NA,NA
"5","#TampaBay 

Hillsborough County Health Officials Issue Blue-Green Algae Bloom Alert For Thonotosassa Lake
. https   share newsbreak com 6isiyhrk","en","49303240","everyone",FALSE,"1773969974010183946",NA,2024-03-30 07:06:15,"1773969974010183946","Husband, World traveler, NewsHound. Photographer, Pilot, Sailor,  Ham Radio, RF Engineering, Business Owner, Tweeting for @NavalTV","https://pbs.twimg.com/profile_images/582035246/DSC_0027_800_normal.JPG","lymanduggan",FALSE,FALSE,"Tampa, Florida","Lyman Duggan VE9NE/W4 🇨🇦 from #PEI","2009-06-21T12:26:01.000Z",NA,"https://t.co/yTcDDtAFbx",0,0,0,0,0,16,917,3801,28823,56,6094,"#TampaBay 

Hillsborough County Health Officials Issue Blue-Green Algae Bloom Alert For Thonotosassa Lake
https://t.co/Fxx41gvEOC",NA,NA
"6","#Tampabay #Algae

Algae in Thonotosassa Lake prompts health alert
. https   www newsbreak com news 3385817049521 algae in thonotosassa lake prompts health alert","en","49303240","everyone",FALSE,"1773869632379617438",NA,2024-03-30 00:27:31,"1773869632379617438","Husband, World traveler, NewsHound. Photographer, Pilot, Sailor,  Ham Radio, RF Engineering, Business Owner, Tweeting for @NavalTV","https://pbs.twimg.com/profile_images/582035246/DSC_0027_800_normal.JPG","lymanduggan",FALSE,FALSE,"Tampa, Florida","Lyman Duggan VE9NE/W4 🇨🇦 from #PEI","2009-06-21T12:26:01.000Z",NA,"https://t.co/yTcDDtAFbx",0,0,0,0,0,17,917,3801,28823,56,6094,"#Tampabay #Algae

Algae in Thonotosassa Lake prompts health alert
https://t.co/L6tqGM2Asq",NA,NA
"7","@JebBush rick scott vetoed a high-speed magnetic bullet train from Tampa to Orlando and he deregulated the sugar and phosphorus industry so now all of South Florida is polluted! Google: toxic blue green algae in Lake Okeechobee and the Caloosahatchee river!. ","en","898215138582552576","everyone",FALSE,"1773230941630050769","113047940",2024-03-28 06:09:36,"1773227564695171162","Green is for the environment & peace is for the people! I don't mind stealing bread from the mouths of decadence! Life liberty and the pursuit of happiness!","https://pbs.twimg.com/profile_images/1754957013157634048/lWE0QGDF_normal.jpg","Anonymitysec",FALSE,FALSE,"Sarasota statistical area!","Anonymous","2017-08-17T16:09:11.000Z",NA,"https://t.co/cS9VR1oqdI",0,0,1,0,0,219,532,304,16499,2,87161,"@JebBush rick scott vetoed a high-speed magnetic bullet train from Tampa to Orlando and he deregulated the sugar and phosphorus industry so now all of South Florida is polluted! Google: toxic blue green algae in Lake Okeechobee and the Caloosahatchee river!",NA,NA
"8","@marklevinshow Rick Scott Vitoed a high-speed magnetic bullet train from Tampa to Miami, red tide rick also deregulated the sugar and phosphorus industry so now all of South Florida is polluted with toxic blue green algae! Google: toxic blue green algae in Lake Okeechobee!. ","en","898215138582552576","everyone",FALSE,"1773089793410253150","38495835",2024-03-27 20:48:43,"1773086313278742899","Green is for the environment & peace is for the people! I don't mind stealing bread from the mouths of decadence! Life liberty and the pursuit of happiness!","https://pbs.twimg.com/profile_images/1754957013157634048/lWE0QGDF_normal.jpg","Anonymitysec",FALSE,FALSE,"Sarasota statistical area!","Anonymous","2017-08-17T16:09:11.000Z",NA,"https://t.co/cS9VR1oqdI",0,0,0,0,0,179,532,304,16499,2,87161,"@marklevinshow Rick Scott Vitoed a high-speed magnetic bullet train from Tampa to Miami, red tide rick also deregulated the sugar and phosphorus industry so now all of South Florida is polluted with toxic blue green algae! Google: toxic blue green algae in Lake Okeechobee!",NA,NA
"9","@asymmetricinfo I would pay $$$ for this for my yard. I live on Tampa Bay &amp; have zero interest in causing pesticide runoff that might cause the next red tide/fish kill/etc.
They make robot lawn mowers, why not a weeder?
Shut up &amp; take my money!","en","500389907","everyone",FALSE,"1770222117419683859","16353245",2024-03-19 22:53:36,"1770220398585487766","","https://pbs.twimg.com/profile_images/833835642979229696/7oqhhgYb_normal.jpg","navillus126",FALSE,FALSE,NA,"chris sullivan","2012-02-23T02:56:37.000Z",NA,NA,0,0,0,0,0,20,123,148,8009,3,21733,"@asymmetricinfo I would pay $$$ for this for my yard. I live on Tampa Bay &amp; have zero interest in causing pesticide runoff that might cause the next red tide/fish kill/etc.
They make robot lawn mowers, why not a weeder?
Shut up &amp; take my money!",NA,NA
"10","RT @SueDeWitt4: @Janabw81 @ResisterNell I got into a giant red tide around Tampa awhile back. I thought I was going to choke to death.","en","1472602521185120264","everyone",FALSE,"1768795915211657596",NA,2024-03-16 00:26:23,"1768795915211657596","love all animals ex photo lab tech.
Abortion is between a woman and her God. NOT you and your agenda.
Always remember! ""Every accusation IS a confession""","https://pbs.twimg.com/profile_images/1472602694867042304/_0NVPTqi_normal.png","Raptorf31590613",FALSE,FALSE,NA,"Raptorfan","2021-12-19T16:20:16.000Z",NA,NA,1,0,0,0,0,0,6842,6695,157725,1,172055,"RT @SueDeWitt4: @Janabw81 @ResisterNell I got into a giant red tide around Tampa awhile back. I thought I was going to choke to death.",NA,NA
"11","@Janabw81 @ResisterNell I got into a giant red tide around Tampa awhile back. I thought I was going to choke to death.","en","1100596163030310913","everyone",FALSE,"1768769985713979449","752575365558603777",2024-03-15 22:43:21,"1768750452479287747","Wow, Elon’s Twitter reinstated my account. 🤷‍♀️. Often like animals more than people. Retired teacher. Proud Democrat. No lists/DM’s please. Peaceful snowflake","https://pbs.twimg.com/profile_images/1106813752404398080/ZBFg6gGN_normal.jpg","SueDeWitt4",FALSE,FALSE,"Wyoming, USA","Sue D","2019-02-27T03:19:08.000Z","1277681933531545600",NA,1,1,10,0,0,343,1472,1943,59472,2,32111,"@Janabw81 @ResisterNell I got into a giant red tide around Tampa awhile back. I thought I was going to choke to death.",NA,NA
"12","@TexasMinx101 @CTOTHELOS77 Venice smelled terrible when I was there, was laden with tourist traps and skeezy people.

Tampa, terrible food, gross Gulf of Mexico beach, with red tide, rude rude people. 

But if you like it, cool.","en","1518696241676251136","everyone",FALSE,"1767709219640209541","1766871869435580416",2024-03-13 00:28:15,"1767348259641802993","A man. You know, a real one.","https://pbs.twimg.com/profile_images/1603460201079656448/fAMxiWHy_normal.jpg","dinosaurfuggit",FALSE,FALSE,"Reality","dinosaurfuggit","2022-04-25T20:59:50.000Z","1674163115188174849",NA,0,1,0,0,0,20,294,490,6949,3,65927,"@TexasMinx101 @CTOTHELOS77 Venice smelled terrible when I was there, was laden with tourist traps and skeezy people.

Tampa, terrible food, gross Gulf of Mexico beach, with red tide, rude rude people. 

But if you like it, cool.",NA,NA
"13","Super dope energy #miamiflorida #hialeah #alabama #southbeach #floridakeys #floridalife #orlando #tampa #miamibeach #miami #bioluminescence #redtide #ocean #fyp #titanic #naturelover #saltlife #flashlight #tech #gadget #everglades #foryou #wildlife #conservation #flaoridaman #all https://t.co/MpuB6lHgRW","en","1510587052999557131","everyone",TRUE,"1767660717308850682",NA,2024-03-12 21:15:31,"1767660717308850682","Afford your insurance medical marijuana at a giveaway tickes. ASAP delivery once payment confirmed Top discreet delivery 🚚","https://pbs.twimg.com/profile_images/1672773634836905987/yyNSyrKq_normal.jpg","candyman4200",FALSE,FALSE,"Tampa, FL","🍭 CANDY MAN","2022-04-03T11:56:55.000Z",NA,NA,0,0,0,0,0,45,69,85,1081,0,167,"Super dope energy #miamiflorida #hialeah #alabama #southbeach #floridakeys #floridalife #orlando #tampa #miamibeach #miami #bioluminescence #redtide #ocean #fyp #titanic #naturelover #saltlife #flashlight #tech #gadget #everglades #foryou #wildlife #conservation #flaoridaman #all https://t.co/MpuB6lHgRW",NA,NA
"14","@craigtimes @RBallogg Manatee River is wide, shallow &amp; slow, w/output into Gulf/Tampa Bay about 18.7cfs (just 1.6M cf/day). It has a sandy bottom, &amp;, where phosphate-fed algae hasn't choked it out, is carpeted w/sea grass, slowing down &amp; catching EVERYTHING.

That literal shit is going nowhere fast.","en","909812860192096256","everyone",FALSE,"1765484888700985427","62575859",2024-03-06 21:09:33,"1765387610296369225","Pinko Atheist, ex Floridiot, FT MH CG, CPP, COVID realist, 🏳️‍🌈ally, JD/LLM envtl⚓law.
Fuck the fascists. Embrace knowledge. Use your 1 life well & kindly.","https://pbs.twimg.com/profile_images/922677673519747072/mlu-4vNV_normal.jpg","nofish_nonuts",FALSE,FALSE,"PNW","no fish, no nuts - 🇺🇦🇵🇸😷","2017-09-18T16:14:24.000Z","1647332845688623104",NA,0,1,1,0,0,26,5468,5988,124987,14,244343,"@craigtimes @RBallogg Manatee River is wide, shallow &amp; slow, w/output into Gulf/Tampa Bay about 18.7cfs (just 1.6M cf/day). It has a sandy bottom, &amp;, where phosphate-fed algae hasn't choked it out, is carpeted w/sea grass, slowing down &amp; catching EVERYTHING.

That literal shit is going nowhere fast.",NA,NA
"15","Algae bloom is way more hot potatoes household debate bait than
 ~Global Warming | Climate Change~ 
in Tampa Bay, Florida
Piney Point was fuuuuuuucked up","en","1573583666139533313","everyone",FALSE,"1759044469494534549",NA,2024-02-18 02:37:37,"1759044469494534549","idc lol (i do and am super serial, guyz)","https://pbs.twimg.com/profile_images/1757752008772042752/1Ngtu84f_normal.png","naythanielc",FALSE,FALSE,"Florida, USA","nathieuu teeple","2022-09-24T08:02:50.000Z",NA,NA,0,0,2,0,0,39,387,338,4276,1,1620,"Algae bloom is way more hot potatoes household debate bait than
 ~Global Warming | Climate Change~ 
in Tampa Bay, Florida
Piney Point was fuuuuuuucked up",NA,NA
"16","@TheDrugMoney Why are you like this? 😂 gotta be those algae blooms in Tampa","en","1730028550852378624","everyone",FALSE,"1757233886004666750","1162370120557223936",2024-02-13 02:43:00,"1757147984242835583","33 |  🇻🇪🇺🇸 | SysAdmin & Investor 💻📈 | Talk and meme all things #Investing | Biggest risk is Not taking one.","https://pbs.twimg.com/profile_images/1754713581373800448/hHYbhq_P_normal.jpg","Jav_Fi",FALSE,FALSE,"Orlando, FL","JavFi | Tech, Dividends & Crypto","2023-11-30T00:59:32.000Z","1752874120415449237",NA,0,0,1,0,0,60,194,97,953,0,1429,"@TheDrugMoney Why are you like this? 😂 gotta be those algae blooms in Tampa",NA,NA
"17","@Bo_Gardiner @justabluevoter @Acyn I started missing the nature long before I left. Thanks to DeSantis letting Piney Point pour hazardous water straight into the bay for years, red tide made many beaches ruined. Dead fish smell was all there was through Tampa, Clearwater, Sarasota and Bradenton.","en","1709988124967739392","everyone",FALSE,"1756320038699610346","1014970967427297280",2024-02-10 14:11:42,"1756113033506759128","","https://pbs.twimg.com/profile_images/1715938186122190848/N5Tx26Lb_normal.jpg","MammoWarrior",FALSE,FALSE,NA,"MammoWarrior","2023-10-05T17:45:36.000Z",NA,NA,0,1,1,0,0,25,14,23,1004,0,1237,"@Bo_Gardiner @justabluevoter @Acyn I started missing the nature long before I left. Thanks to DeSantis letting Piney Point pour hazardous water straight into the bay for years, red tide made many beaches ruined. Dead fish smell was all there was through Tampa, Clearwater, Sarasota and Bradenton.",NA,NA
"18","RT @UF_MaryLusk: Congratulations to newly minted PhD @munialgal for successfully defending her PhD dissertation this week. Her work on dissolved organic matter and #HABs in Tampa Bay is groundbreaking and important.  @UFSNRE @UFGulfCoastREC @EbanBean @algae_slayer #ProudAdvisor . https   twitter com UF_MaryLusk status 1752111295233462510 photo 1","en","374834303","everyone",FALSE,"1752707325440496047",NA,2024-01-31 14:56:04,"1752707325440496047","The FTGA is dedicated to education, research & promotion of environmentally-responsible, professional & scientifically-based management practices for turfgrass.","https://pbs.twimg.com/profile_images/936573757707124737/A--FBDa2_normal.jpg","FloridaTGA",FALSE,FALSE,"Florida","FTGA","2011-09-17T01:32:36.000Z",NA,"https://t.co/jXxgTGhBzf",4,0,0,0,0,0,1775,1212,2951,12,3333,"RT @UF_MaryLusk: Congratulations to newly minted PhD @munialgal for successfully defending her PhD dissertation this week. Her work on dissolved organic matter and #HABs in Tampa Bay is groundbreaking and important.  @UFSNRE @UFGulfCoastREC @EbanBean @algae_slayer #ProudAdvisor https://t.co/jxfuHvvKSy",NA,NA
"19","RT @UF_MaryLusk: Congratulations to newly minted PhD @munialgal for successfully defending her PhD dissertation this week. Her work on dissolved organic matter and #HABs in Tampa Bay is groundbreaking and important.  @UFSNRE @UFGulfCoastREC @EbanBean @algae_slayer #ProudAdvisor . https   twitter com UF_MaryLusk status 1752111295233462510 photo 1","en","31809215","everyone",FALSE,"1752657373527761156",NA,2024-01-31 11:37:35,"1752657373527761156","Dr. Dukes specializes in water management and water quality of biological systems.  He leads a research team investigating water conservation in urban systems.","https://pbs.twimg.com/profile_images/2343134321/image_normal.jpg","mddukes",FALSE,FALSE,NA,"Michael Dukes","2009-04-16T14:00:59.000Z",NA,"http://t.co/sP3XDKnYCk",4,0,0,0,0,0,823,149,2666,15,6234,"RT @UF_MaryLusk: Congratulations to newly minted PhD @munialgal for successfully defending her PhD dissertation this week. Her work on dissolved organic matter and #HABs in Tampa Bay is groundbreaking and important.  @UFSNRE @UFGulfCoastREC @EbanBean @algae_slayer #ProudAdvisor https://t.co/jxfuHvvKSy",NA,NA
"20","RT @UF_MaryLusk: Congratulations to newly minted PhD @munialgal for successfully defending her PhD dissertation this week. Her work on dissolved organic matter and #HABs in Tampa Bay is groundbreaking and important.  @UFSNRE @UFGulfCoastREC @EbanBean @algae_slayer #ProudAdvisor . https   twitter com UF_MaryLusk status 1752111295233462510 photo 1","en","1460730791890198529","everyone",FALSE,"1752218718367613280",NA,2024-01-30 06:34:31,"1752218718367613280","Scientist - University of Florida - MS Soil, Water, and Ecosystem Sciences ‘23. Auburn University SFWS ‘21.","https://pbs.twimg.com/profile_images/1460733015559131138/QRHm2qbD_normal.jpg","dylanisonaboat",FALSE,FALSE,"Bradenton, FL | Auburn AL | WV","Dylan Barr","2021-11-16T22:05:45.000Z",NA,NA,4,0,0,0,0,0,33,80,94,0,417,"RT @UF_MaryLusk: Congratulations to newly minted PhD @munialgal for successfully defending her PhD dissertation this week. Her work on dissolved organic matter and #HABs in Tampa Bay is groundbreaking and important.  @UFSNRE @UFGulfCoastREC @EbanBean @algae_slayer #ProudAdvisor https://t.co/jxfuHvvKSy",NA,NA
"21","RT @UF_MaryLusk: Congratulations to newly minted PhD @munialgal for successfully defending her PhD dissertation this week. Her work on dissolved organic matter and #HABs in Tampa Bay is groundbreaking and important.  @UFSNRE @UFGulfCoastREC @EbanBean @algae_slayer #ProudAdvisor . https   twitter com UF_MaryLusk status 1752111295233462510 photo 1","en","2359941007","everyone",FALSE,"1752111579716338010",NA,2024-01-29 23:28:47,"1752111579716338010","IrriGator is a @UF water resource engineer, soil/water scientist & Extension water specialist collaboration to showcase research & engage audiences. RT ≠ E.","https://pbs.twimg.com/profile_images/438043518812954624/jlkm9aEz_normal.png","IrriGatorUF",FALSE,FALSE,"Gainesville, FL","UF/IFAS IrriGator","2014-02-24T19:23:52.000Z",NA,"http://t.co/LupQUuP4XZ",4,0,0,0,0,0,1403,609,6544,30,9748,"RT @UF_MaryLusk: Congratulations to newly minted PhD @munialgal for successfully defending her PhD dissertation this week. Her work on dissolved organic matter and #HABs in Tampa Bay is groundbreaking and important.  @UFSNRE @UFGulfCoastREC @EbanBean @algae_slayer #ProudAdvisor https://t.co/jxfuHvvKSy",NA,NA
"22","Congratulations to newly minted PhD @munialgal for successfully defending her PhD dissertation this week. Her work on dissolved organic matter and #HABs in Tampa Bay is groundbreaking and important.  @UFSNRE @UFGulfCoastREC @EbanBean @algae_slayer #ProudAdvisor . https   twitter com UF_MaryLusk status 1752111295233462510 photo 1","en","784048897438146560","everyone",FALSE,"1752111295233462510",NA,2024-01-29 23:27:40,"1752111295233462510","Univ Florida Assistant Prof of Soil and Water Sciences, mom of 3 great boys, stormwater chaser, urban biogeochemist, Mormon woman, Floridian","https://pbs.twimg.com/profile_images/784168001553756160/TMJn-mTX_normal.jpg","UF_MaryLusk",FALSE,FALSE,NA,"Dr. Mary Lusk","2016-10-06T15:13:19.000Z",NA,NA,4,0,21,1,0,932,557,124,530,13,1785,"Congratulations to newly minted PhD @munialgal for successfully defending her PhD dissertation this week. Her work on dissolved organic matter and #HABs in Tampa Bay is groundbreaking and important.  @UFSNRE @UFGulfCoastREC @EbanBean @algae_slayer #ProudAdvisor https://t.co/jxfuHvvKSy",NA,NA
"23","RT @Whippersteve: @lesleyabravanel In 2021 at Piney Point, 215 million gallons of waste water with environmentally toxic levels of nutrients including radioactive phosphogypsum leaked in Tampa Bay causing red tide. Now DeSantis and the Florida legislature want to use same kind of waste to build Florida's highways.. ","en","68013382","everyone",FALSE,"1752102192318685689",NA,2024-01-29 22:51:29,"1752102192318685689","Vegan;wildlife rehabilitator. Writer;fighter for those who have no voice. Lover of nature + all wild things! “Find the beauty in every day.”","https://pbs.twimg.com/profile_images/2442443809/image_normal.jpg","wildlifer22",FALSE,FALSE,"Blue dot in red state Indiana","Beth 🐾🐾 🇺🇦🌻","2009-08-22T23:30:58.000Z","1225862843091816448",NA,17,0,0,0,0,0,3029,4828,109767,44,2592,"RT @Whippersteve: @lesleyabravanel In 2021 at Piney Point, 215 million gallons of waste water with environmentally toxic levels of nutrients including radioactive phosphogypsum leaked in Tampa Bay causing red tide. Now DeSantis and the Florida legislature want to use same kind of waste to build Florida's highways.",NA,NA
"24","RT @Whippersteve: @lesleyabravanel In 2021 at Piney Point, 215 million gallons of waste water with environmentally toxic levels of nutrients including radioactive phosphogypsum leaked in Tampa Bay causing red tide. Now DeSantis and the Florida legislature want to use same kind of waste to build Florida's highways.. ","en","609579708","everyone",FALSE,"1752072924792832397",NA,2024-01-29 20:55:11,"1752072924792832397","I’m an IT Recruiter and a digital product marketer. I also do affiliate marketing and want to help other people start their side hustle. Let’s help each other.","https://pbs.twimg.com/profile_images/1338530177953878017/mxH5h7qj_normal.jpg","Stay_Collected",FALSE,FALSE,"Buckeye, AZ","Concerned American","2012-06-15T22:52:42.000Z",NA,NA,17,0,0,0,0,0,1251,709,47648,9,210543,"RT @Whippersteve: @lesleyabravanel In 2021 at Piney Point, 215 million gallons of waste water with environmentally toxic levels of nutrients including radioactive phosphogypsum leaked in Tampa Bay causing red tide. Now DeSantis and the Florida legislature want to use same kind of waste to build Florida's highways.",NA,NA
"25","RT @Whippersteve: @lesleyabravanel In 2021 at Piney Point, 215 million gallons of waste water with environmentally toxic levels of nutrients including radioactive phosphogypsum leaked in Tampa Bay causing red tide. Now DeSantis and the Florida legislature want to use same kind of waste to build Florida's highways.. ","en","1643985121","everyone",FALSE,"1752037770015478118",NA,2024-01-29 18:35:30,"1752037770015478118","Former Teacher, political junkie & book lover. There are two kinds of readers in the world-those who read to remember, and those who read to forget.","https://pbs.twimg.com/profile_images/1656329726615592964/eBMs1je-_normal.jpg","SwankAmy",FALSE,FALSE,"Florida, USA","Amy","2013-08-04T00:31:18.000Z",NA,NA,17,0,0,0,0,0,74,329,8885,1,20235,"RT @Whippersteve: @lesleyabravanel In 2021 at Piney Point, 215 million gallons of waste water with environmentally toxic levels of nutrients including radioactive phosphogypsum leaked in Tampa Bay causing red tide. Now DeSantis and the Florida legislature want to use same kind of waste to build Florida's highways.",NA,NA
"26","RT @Whippersteve: @lesleyabravanel In 2021 at Piney Point, 215 million gallons of waste water with environmentally toxic levels of nutrients including radioactive phosphogypsum leaked in Tampa Bay causing red tide. Now DeSantis and the Florida legislature want to use same kind of waste to build Florida's highways.. ","en","568326801","everyone",FALSE,"1752029606197014948",NA,2024-01-29 18:03:03,"1752029606197014948","","https://pbs.twimg.com/profile_images/1100604680244260864/iBfRwJ3S_normal.jpg","dstotesbery1967",FALSE,FALSE,"United States","D stotes","2012-05-01T14:21:17.000Z",NA,NA,17,0,0,0,0,0,98,134,2516,0,6315,"RT @Whippersteve: @lesleyabravanel In 2021 at Piney Point, 215 million gallons of waste water with environmentally toxic levels of nutrients including radioactive phosphogypsum leaked in Tampa Bay causing red tide. Now DeSantis and the Florida legislature want to use same kind of waste to build Florida's highways.",NA,NA
