"","text","created_at.x","lang","author_id","possibly_sensitive","reply_settings","id","conversation_id","protected","created_at.y","username","name","location","url","verified","description","profile_image_url","pinned_tweet_id","public_metrics.x_retweet_count","public_metrics.x_reply_count","public_metrics.x_like_count","public_metrics.x_quote_count","public_metrics.x_bookmark_count","public_metrics.x_impression_count","public_metrics.y_followers_count","public_metrics.y_following_count","public_metrics.y_tweet_count","public_metrics.y_listed_count","public_metrics.y_like_count","public_metrics.y_media_count","text_with_display_links","in_reply_to_user_id","reply.to.thread.no.term","geo_place_id"
"1","🏖️⚠️The red tide organism Karenia brevis was detected in 54 samples collected from Southwest Florida in Pinellas, Sarasota, Charlotte, Lee, Hillsborough and Manatee counties. Red tide can cause breathing difficulty in people and pets. #Poison Help 1-800-222-1222. . https   x com FloridaPoison status 1866241413274337701 video 1",2024-12-09 22:00:00,"en","236390420",FALSE,"everyone","1866241413274337701","1866241413274337701",FALSE,"2011-01-10T13:44:51.000Z","FloridaPoison","FL Poison Control","Florida, USA","https://t.co/JPynmUPoh3",FALSE,"Florida's Poison Control Centers provide free, confidential help with poisoning emergencies 24/7/365 @ 1-800-222-1222. RTs/follows/favorites ≠ endorsement","https://pbs.twimg.com/profile_images/798194714281316352/nEcHrPCl_normal.jpg",NA,0,0,0,0,0,31,1155,427,10634,21,2598,4850,"🏖️⚠️The red tide organism Karenia brevis was detected in 54 samples collected from Southwest Florida in Pinellas, Sarasota, Charlotte, Lee, Hillsborough and Manatee counties. Red tide can cause breathing difficulty in people and pets. #Poison Help 1-800-222-1222. https://t.co/azbHFNMgbI",NA,NA,NA
"2","🏖️⚠️The red tide organism Karenia brevis was detected in 54 samples collected from Southwest Florida in Pinellas, Sarasota, Charlotte, Lee, Hillsborough and Manatee counties. Red tide can cause breathing difficulty in people and pets. #Poison Help 1-800-222-1222. . https   x com FloridaPoison status 1866135968069337395 video 1",2024-12-09 15:01:00,"en","236390420",FALSE,"everyone","1866135968069337395","1866135968069337395",FALSE,"2011-01-10T13:44:51.000Z","FloridaPoison","FL Poison Control","Florida, USA","https://t.co/JPynmUPoh3",FALSE,"Florida's Poison Control Centers provide free, confidential help with poisoning emergencies 24/7/365 @ 1-800-222-1222. RTs/follows/favorites ≠ endorsement","https://pbs.twimg.com/profile_images/798194714281316352/nEcHrPCl_normal.jpg",NA,0,0,0,0,0,37,1155,427,10634,21,2598,4850,"🏖️⚠️The red tide organism Karenia brevis was detected in 54 samples collected from Southwest Florida in Pinellas, Sarasota, Charlotte, Lee, Hillsborough and Manatee counties. Red tide can cause breathing difficulty in people and pets. #Poison Help 1-800-222-1222. https://t.co/etkmoQ9IOi",NA,NA,NA
"3","⚠️The latest @MyFWC report shows the red tide organism detected in 49 samples in or offshore in Pinellas, Manatee, Sarasota, Charlotte, Lee and Citrus Counties. Red tide can cause breathing difficulty in people and pets. #Poison Help 1-800-222-1222. . https   x com FloridaPoison status 1864761913235632462 video 1",2024-12-05 20:01:00,"en","236390420",FALSE,"everyone","1864761913235632462","1864761913235632462",FALSE,"2011-01-10T13:44:51.000Z","FloridaPoison","FL Poison Control","Florida, USA","https://t.co/JPynmUPoh3",FALSE,"Florida's Poison Control Centers provide free, confidential help with poisoning emergencies 24/7/365 @ 1-800-222-1222. RTs/follows/favorites ≠ endorsement","https://pbs.twimg.com/profile_images/798194714281316352/nEcHrPCl_normal.jpg",NA,0,0,0,0,0,45,1155,427,10634,21,2598,4850,"⚠️The latest @MyFWC report shows the red tide organism detected in 49 samples in or offshore in Pinellas, Manatee, Sarasota, Charlotte, Lee and Citrus Counties. Red tide can cause breathing difficulty in people and pets. #Poison Help 1-800-222-1222. https://t.co/Vxq47EFtY6",NA,NA,NA
"4","State environmental officials have noted fish kills suspected to be caused by red tide in Pinellas County, along with reports of respiratory irritation in both Pinellas and Sarasota counties...



#PIESun. https   pie sun com 2024 12 05 red tide persists in southern pinellas manatee and sarasota counties",2024-12-05 19:30:23,"en","1839381876211113984",FALSE,"everyone","1864754210719350950","1864754210719350950",FALSE,"2024-09-26T19:10:16.000Z","ThePIESun","St. Pete-Clearwater Sun","St. Petersburg, Florida","https://t.co/5lLoq2abmx",FALSE,"Local St. Pete-Clearwater, Florida News, Events, and Destinations","https://pbs.twimg.com/profile_images/1839382051910520832/-AsxpgmZ_normal.jpg",NA,0,0,0,0,0,12,7,39,465,0,9,9,"State environmental officials have noted fish kills suspected to be caused by red tide in Pinellas County, along with reports of respiratory irritation in both Pinellas and Sarasota counties...

https://t.co/cDa5UZHWuW

#PIESun",NA,NA,NA
"5","🏖️⚠️The latest @MyFWC report shows the red tide organism detected in 49 samples in or offshore in Pinellas, Manatee, Sarasota, Charlotte, Lee and Citrus Counties. Red tide can cause breathing difficulty in people and pets. #Poison Help 1-800-222-1222. . https   x com FloridaPoison status 1864655461628207612 video 1",2024-12-05 12:58:00,"en","236390420",FALSE,"everyone","1864655461628207612","1864655461628207612",FALSE,"2011-01-10T13:44:51.000Z","FloridaPoison","FL Poison Control","Florida, USA","https://t.co/JPynmUPoh3",FALSE,"Florida's Poison Control Centers provide free, confidential help with poisoning emergencies 24/7/365 @ 1-800-222-1222. RTs/follows/favorites ≠ endorsement","https://pbs.twimg.com/profile_images/798194714281316352/nEcHrPCl_normal.jpg",NA,0,0,0,0,0,64,1155,427,10634,21,2598,4850,"🏖️⚠️The latest @MyFWC report shows the red tide organism detected in 49 samples in or offshore in Pinellas, Manatee, Sarasota, Charlotte, Lee and Citrus Counties. Red tide can cause breathing difficulty in people and pets. #Poison Help 1-800-222-1222. https://t.co/SCqtuAFAiF",NA,NA,NA
"6","RT @wusf: But persistent winds from the north could push much of the algae bloom to the south over the rest of the week.
. https   www wusf org environment 2024 12 04 red tide lingers in southern pinellas manatee and sarasota counties",2024-12-05 12:25:46,"en","377666632",FALSE,"everyone","1864647349710278935","1864647349710278935",FALSE,"2011-09-21T22:53:34.000Z","radiocraigkopp","Craig Kopp","Land O Lakes, Florida",NA,FALSE,"Radio man, Podcast man, Writer man","https://pbs.twimg.com/profile_images/1490711932650889217/kLsdYtt5_normal.jpg",NA,1,0,0,0,0,0,958,1523,43211,51,40109,259,"RT @wusf: But persistent winds from the north could push much of the algae bloom to the south over the rest of the week.
https://t.co/0DOri8OIwi",NA,NA,NA
"7","But persistent winds from the north could push much of the algae bloom to the south over the rest of the week.
. https   www wusf org environment 2024 12 04 red tide lingers in southern pinellas manatee and sarasota counties",2024-12-05 12:20:29,"en","17544442",FALSE,"everyone","1864646021042852222","1864646021042852222",FALSE,"2008-11-21T20:07:08.000Z","wusf","WUSF","Tampa, FL","https://t.co/KBo4cZ4tOe",FALSE,"WUSF Public Media is the Tampa Bay area’s source for news, in-depth reporting, educational programming, arts, and the finest classical music.","https://pbs.twimg.com/profile_images/1714703492890394624/IOVwz2sB_normal.jpg","1787836246024437952",1,0,1,0,0,81,14952,2307,41565,456,2726,4732,"But persistent winds from the north could push much of the algae bloom to the south over the rest of the week.
https://t.co/0DOri8OIwi",NA,NA,NA
"8","Dead fish are starting to wash up on our shore due to toxins in the water. The FWC identified red tide in Pinellas, Manatee and Sarasota Counties. . https   www abcactionnews com news region pinellas experts monitor red tide blooms in pinellas manatee and sarasota counties",2024-12-03 01:45:00,"en","15138087",FALSE,"everyone","1863761321759571988","1863761321759571988",FALSE,"2008-06-16T20:08:51.000Z","abcactionnews","ABC Action News","Tampa","https://t.co/VHYcXWsUHd",FALSE,"ABC Action News is Taking Action For You! Award-winning Breaking News coverage in the Tampa Bay area","https://pbs.twimg.com/profile_images/875429460807438337/4yx0qIuz_normal.jpg",NA,0,0,0,0,0,832,180740,630,202154,1589,4869,53518,"Dead fish are starting to wash up on our shore due to toxins in the water. The FWC identified red tide in Pinellas, Manatee and Sarasota Counties. https://t.co/RCQGZUPZtz",NA,NA,NA
"9","RT @NWSTampaBay: Over the next 36 hours, @NOAACoastalSci is forecasting a HIGH risk of respiratory irritation from Karenia brevis (red tide) at some beaches in PINELLAS county. Conditions may vary. For latest updates at individual beaches, see  #flwx. http   coastalscience noaa gov science areas habs hab forecasts gulf of mexico",2024-12-03 01:05:07,"en","1588410537741897728",FALSE,"everyone","1863751284387443158","1863751284387443158",FALSE,"2022-11-04T05:59:56.000Z","FLhurricanes1","Florida’s Stormchasing Adventures"," florida ","https://t.co/rnqPbhdBsQ",FALSE,"i'm Certified Skywarn Storm Spotter through NWS Tampa Bay  Future meteorologist-storm chaser- Weather Enthusiast follow me  for more thank you","https://pbs.twimg.com/profile_images/1826405251013828608/qWtbuLeM_normal.jpg",NA,8,0,0,0,0,0,459,2032,2437,4,10293,28,"RT @NWSTampaBay: Over the next 36 hours, @NOAACoastalSci is forecasting a HIGH risk of respiratory irritation from Karenia brevis (red tide) at some beaches in PINELLAS county. Conditions may vary. For latest updates at individual beaches, see https://t.co/vqAaLYoVUz #flwx",NA,NA,NA
"10","🏖️⚠️Red tide is still very present along Florida's Gulf Coast, especially in Sarasota, Manatee, Hillsborough and Pinellas counties. Red tide can cause breathing difficulty in people and pets.
#Poison Help 1-800-222-1222.
. https   www wtsp com article news red tide red tide current conditions map florida 67 7d9d432d 88c7 4397 937b 7db37145b4ac",2024-12-02 17:01:00,"en","236390420",FALSE,"everyone","1863629451772432841","1863629451772432841",FALSE,"2011-01-10T13:44:51.000Z","FloridaPoison","FL Poison Control","Florida, USA","https://t.co/JPynmUPoh3",FALSE,"Florida's Poison Control Centers provide free, confidential help with poisoning emergencies 24/7/365 @ 1-800-222-1222. RTs/follows/favorites ≠ endorsement","https://pbs.twimg.com/profile_images/798194714281316352/nEcHrPCl_normal.jpg",NA,0,0,0,0,0,29,1172,426,10558,21,2598,4808,"🏖️⚠️Red tide is still very present along Florida's Gulf Coast, especially in Sarasota, Manatee, Hillsborough and Pinellas counties. Red tide can cause breathing difficulty in people and pets.
#Poison Help 1-800-222-1222.
https://t.co/2QV86V7aoR",NA,NA,NA
"11","RT @NWSTampaBay: Over the next 36 hours, @NOAACoastalSci is forecasting a HIGH risk of respiratory irritation from Karenia brevis (red tide) at some beaches in PINELLAS county. Conditions may vary. For latest updates at individual beaches, see  #flwx. http   coastalscience noaa gov science areas habs hab forecasts gulf of mexico",2024-12-02 16:19:05,"en","1651977795180822529",FALSE,"everyone","1863618903261266078","1863618903261266078",FALSE,"2023-04-28T15:57:54.000Z","SuzanneBos43679","Suzanne@cookinmaama",NA,NA,FALSE,"🐬🏳️‍🌈🏳️‍⚧️
Florida native, Iifelong Miami Dolphins fan.  Mom, Grandma, BLM, Pro-Choice. 🔩 DeFascist and Trump.","https://pbs.twimg.com/profile_images/1652000848233263109/2ViG0vxG_normal.jpg","1792611447194968218",8,0,0,0,0,0,1762,1537,171308,8,115483,1471,"RT @NWSTampaBay: Over the next 36 hours, @NOAACoastalSci is forecasting a HIGH risk of respiratory irritation from Karenia brevis (red tide) at some beaches in PINELLAS county. Conditions may vary. For latest updates at individual beaches, see https://t.co/vqAaLYoVUz #flwx",NA,NA,NA
"12","RT @NWSTampaBay: Over the next 36 hours, @NOAACoastalSci is forecasting a HIGH risk of respiratory irritation from Karenia brevis (red tide) at some beaches in PINELLAS county. Conditions may vary. For latest updates at individual beaches, see  #flwx. http   coastalscience noaa gov science areas habs hab forecasts gulf of mexico",2024-12-02 15:45:49,"en","741032004460892160",FALSE,"everyone","1863610530893570135","1863610530893570135",FALSE,"2016-06-09T22:19:32.000Z","overandout003","BARN"," FLORIDA",NA,FALSE,"ADULT CONTENT 21+","https://pbs.twimg.com/profile_images/1086140139913596928/rBVCXCBg_normal.jpg","1437973857584001026",8,0,0,0,0,0,3459,1854,220352,20,392506,40919,"RT @NWSTampaBay: Over the next 36 hours, @NOAACoastalSci is forecasting a HIGH risk of respiratory irritation from Karenia brevis (red tide) at some beaches in PINELLAS county. Conditions may vary. For latest updates at individual beaches, see https://t.co/vqAaLYoVUz #flwx",NA,NA,NA
"13","RT @NWSTampaBay: Over the next 36 hours, @NOAACoastalSci is forecasting a HIGH risk of respiratory irritation from Karenia brevis (red tide) at some beaches in PINELLAS county. Conditions may vary. For latest updates at individual beaches, see  #flwx. http   coastalscience noaa gov science areas habs hab forecasts gulf of mexico",2024-12-02 15:11:19,"en","2815093011",FALSE,"everyone","1863601847023321322","1863601847023321322",FALSE,"2014-10-08T11:54:12.000Z","CleanAirMoms_FL","Florida Moms","Florida","https://t.co/W1TsiLeUKt",FALSE,"We're a community of moms and dads who are uniting for clean air and our kids’ health in #Florida.","https://pbs.twimg.com/profile_images/1410583600727212032/BxDzulot_normal.jpg","1859334495960256988",8,0,0,0,0,0,1145,1412,8607,44,9179,805,"RT @NWSTampaBay: Over the next 36 hours, @NOAACoastalSci is forecasting a HIGH risk of respiratory irritation from Karenia brevis (red tide) at some beaches in PINELLAS county. Conditions may vary. For latest updates at individual beaches, see https://t.co/vqAaLYoVUz #flwx",NA,NA,NA
"14","RT @NWSTampaBay: Over the next 36 hours, @NOAACoastalSci is forecasting a HIGH risk of respiratory irritation from Karenia brevis (red tide) at some beaches in PINELLAS county. Conditions may vary. For latest updates at individual beaches, see  #flwx. http   coastalscience noaa gov science areas habs hab forecasts gulf of mexico",2024-12-02 14:58:54,"en","2507601764",FALSE,"everyone","1863598724183625934","1863598724183625934",FALSE,"2014-05-19T14:43:58.000Z","noaacoastalsci","NOAA Coastal Ocean Science","United States of America","https://t.co/4LXAlnxJEs",FALSE,"@NOAA's National Centers for Coastal Ocean Science is a fed govt office. Verification: https://t.co/oYrBZk5e0j","https://pbs.twimg.com/profile_images/1816860590708584448/7jL_n6VN_normal.jpg","1802716432146350427",8,0,0,0,0,0,6493,222,2517,159,1287,1674,"RT @NWSTampaBay: Over the next 36 hours, @NOAACoastalSci is forecasting a HIGH risk of respiratory irritation from Karenia brevis (red tide) at some beaches in PINELLAS county. Conditions may vary. For latest updates at individual beaches, see https://t.co/vqAaLYoVUz #flwx",NA,NA,NA
"15","RT @NWSTampaBay: Over the next 36 hours, @NOAACoastalSci is forecasting a HIGH risk of respiratory irritation from Karenia brevis (red tide) at some beaches in PINELLAS county. Conditions may vary. For latest updates at individual beaches, see  #flwx. http   coastalscience noaa gov science areas habs hab forecasts gulf of mexico",2024-12-02 14:49:19,"en","831234840628445186",FALSE,"everyone","1863596314287579259","1863596314287579259",FALSE,"2017-02-13T20:13:24.000Z","Praedictix","Praedictix Weather","Minneapolis, MN","https://t.co/V42YPIHdiK",FALSE,"Praedictix relies on the human factor. Connect with our expert meteorologists and learn how we can personalize your weather narrative.","https://pbs.twimg.com/profile_images/831630014978289665/n2ngk-Ow_normal.jpg","1653505481766326296",8,0,0,0,0,0,1514,1482,17080,26,5368,6180,"RT @NWSTampaBay: Over the next 36 hours, @NOAACoastalSci is forecasting a HIGH risk of respiratory irritation from Karenia brevis (red tide) at some beaches in PINELLAS county. Conditions may vary. For latest updates at individual beaches, see https://t.co/vqAaLYoVUz #flwx",NA,NA,NA
"16","RT @NWSTampaBay: Over the next 36 hours, @NOAACoastalSci is forecasting a HIGH risk of respiratory irritation from Karenia brevis (red tide) at some beaches in PINELLAS county. Conditions may vary. For latest updates at individual beaches, see  #flwx. http   coastalscience noaa gov science areas habs hab forecasts gulf of mexico",2024-12-02 14:36:12,"en","239613246",FALSE,"everyone","1863593011482968134","1863593011482968134",FALSE,"2011-01-18T01:18:21.000Z","chaser84","chaser",NA,NA,FALSE,"","https://pbs.twimg.com/profile_images/1455202921046499339/6GSPY0lD_normal.jpg",NA,8,0,0,0,0,0,917,5135,53253,4,132166,6929,"RT @NWSTampaBay: Over the next 36 hours, @NOAACoastalSci is forecasting a HIGH risk of respiratory irritation from Karenia brevis (red tide) at some beaches in PINELLAS county. Conditions may vary. For latest updates at individual beaches, see https://t.co/vqAaLYoVUz #flwx",NA,NA,NA
"17","Over the next 36 hours, @NOAACoastalSci is forecasting a HIGH risk of respiratory irritation from Karenia brevis (red tide) at some beaches in PINELLAS county. Conditions may vary. For latest updates at individual beaches, see  #flwx. http   coastalscience noaa gov science areas habs hab forecasts gulf of mexico",2024-12-02 14:34:57,"en","590195750",FALSE,"everyone","1863592695341695254","1863592695341695254",FALSE,"2012-05-25T18:10:38.000Z","NWSTampaBay","NWS Tampa Bay","Tampa Bay, Florida","https://t.co/X31SJ6MGAH",TRUE,"Official Twitter account for the National Weather Service Tampa Bay Area, FL. Details: http://t.co/KKTK7cZlhK","https://pbs.twimg.com/profile_images/875684318441385984/xXJdcbmq_normal.jpg",NA,8,0,14,1,0,2831,76830,711,55558,1765,5835,15756,"Over the next 36 hours, @NOAACoastalSci is forecasting a HIGH risk of respiratory irritation from Karenia brevis (red tide) at some beaches in PINELLAS county. Conditions may vary. For latest updates at individual beaches, see https://t.co/vqAaLYoVUz #flwx",NA,NA,NA
"18","The Florida Fish and Wildlife Conservation Commission (FWC) has detected low levels of red tide (K. brevis) in Pinellas County over the past week. Sample processing is ongoing. Check Red Tide Status:  or 
(1/2) . https   myfwc maps arcgis com apps View index html. https   pinellas gov red tide. https   x com TresIslandFL status 1863591457426190557 photo 1",2024-12-02 14:30:01,"en","95925121",FALSE,"everyone","1863591457426190557","1863591457426190557",FALSE,"2009-12-10T15:40:22.000Z","TresIslandFL","Treasure Island, FL","Treasure Island, FL","https://t.co/3capR2Wztt",TRUE,"Treasure Island, located along the Gulf of Mexico, is home to white sandy beaches, pristine waters, hotels, restaurants and family-friendly attractions.","https://pbs.twimg.com/profile_images/1673324897206927367/8Llo51gE_normal.jpg",NA,0,1,6,0,0,490,5399,156,4742,48,519,3048,"The Florida Fish and Wildlife Conservation Commission (FWC) has detected low levels of red tide (K. brevis) in Pinellas County over the past week. Sample processing is ongoing. Check Red Tide Status: https://t.co/EmSRanWiEl or https://t.co/71ccwqpUio
(1/2) https://t.co/FWcyYnmIEK",NA,NA,NA
"19","Red tide warning for anyone heading to beaches near Tampa Bay. Heavy concentrations of the toxin were found at four beaches in Sarasota County and at Anna Maria Island in Manatee County and Fort De Soto in Pinellas County. #Poison Help 1-800-222-1222.
. https   health wusf usf edu health news florida 2024 11 17 red tide is on the march along beaches in the tampa bay area",2024-11-19 15:01:06,"en","236390420",FALSE,"everyone","1858888237491908671","1858888237491908671",FALSE,"2011-01-10T13:44:51.000Z","FloridaPoison","FL Poison Control","Florida, USA","https://t.co/JPynmUPoh3",FALSE,"Florida's Poison Control Centers provide free, confidential help with poisoning emergencies 24/7/365 @ 1-800-222-1222. RTs/follows/favorites ≠ endorsement","https://pbs.twimg.com/profile_images/798194714281316352/nEcHrPCl_normal.jpg",NA,0,0,0,0,0,39,1205,428,10397,21,2595,NA,"Red tide warning for anyone heading to beaches near Tampa Bay. Heavy concentrations of the toxin were found at four beaches in Sarasota County and at Anna Maria Island in Manatee County and Fort De Soto in Pinellas County. #Poison Help 1-800-222-1222.
https://t.co/PMxF9qFevD",NA,FALSE,NA
"20","🌊The red tide organism Karenia brevis was detected in 74 samples collected from SW #Florida. Bloom concentrations were observed: 1 off Pinellas, 1 in Hillsborough and Manatee, 5 in Sarasota, 2 in and offshore of Charlotte, and 1 in Lee Counties. #Poison Help 1-800-222-1222.. ",2024-11-18 21:01:00,"en","236390420",FALSE,"everyone","1858616419304567020","1858616419304567020",FALSE,"2011-01-10T13:44:51.000Z","FloridaPoison","FL Poison Control","Florida, USA","https://t.co/JPynmUPoh3",FALSE,"Florida's Poison Control Centers provide free, confidential help with poisoning emergencies 24/7/365 @ 1-800-222-1222. RTs/follows/favorites ≠ endorsement","https://pbs.twimg.com/profile_images/798194714281316352/nEcHrPCl_normal.jpg",NA,0,0,0,0,0,22,1205,428,10397,21,2595,NA,"🌊The red tide organism Karenia brevis was detected in 74 samples collected from SW #Florida. Bloom concentrations were observed: 1 off Pinellas, 1 in Hillsborough and Manatee, 5 in Sarasota, 2 in and offshore of Charlotte, and 1 in Lee Counties. #Poison Help 1-800-222-1222.",NA,FALSE,NA
"21","RT @wusf: Heavier concentrations were found at several beaches in Pinellas, Manatee and Sarasota counties.
. https   www wusf org environment 2024 11 15 red tide on march along beaches pinellas manatee sarasota",2024-11-18 17:44:07,"en","730963068",FALSE,"everyone","1858566872083365945","1858566872083365945",FALSE,"2012-08-01T16:09:25.000Z","wusfschreiner","Mark Schreiner","Palm Harbor, FL",NA,FALSE,"Asst. News Director / Intern Coordinator, WUSF 89.7 FM.
Enjoys wine & a good IPA, good friends and great writing.","https://pbs.twimg.com/profile_images/1101507802181365765/dw5MfqNI_normal.jpg",NA,3,0,0,0,0,0,1767,3039,25628,57,170262,NA,"RT @wusf: Heavier concentrations were found at several beaches in Pinellas, Manatee and Sarasota counties.
https://t.co/vDAZ18YSHQ",NA,FALSE,NA
"22","Heavier concentrations of red tide were found this week at several beaches in Pinellas, Manatee and Sarasota counties. Respiratory irritation was also reported. . https   health wusf usf edu health news florida 2024 11 17 red tide is on the march along beaches in the tampa bay area",2024-11-18 15:00:02,"en","20798645",FALSE,"everyone","1858525579814883457","1858525579814883457",FALSE,"2009-02-13T19:36:57.000Z","HealthNewsFL","Health News Florida","Tampa, FL","https://t.co/EXlbTcb8Uq",FALSE,"Since 2006, we've provided in-depth health journalism for Floridians. We're a part of WUSF Public Media, with reporters in Tampa, Miami and Orlando.","https://pbs.twimg.com/profile_images/2626960293/xmwpbvpgbv34f2krgmvb_normal.jpeg",NA,0,0,0,0,0,20,6591,4031,30134,268,68,NA,"Heavier concentrations of red tide were found this week at several beaches in Pinellas, Manatee and Sarasota counties. Respiratory irritation was also reported. https://t.co/GnjgcgAKQQ",NA,FALSE,NA
"23","Red tide alert issued for Sarasota, Pinellas area beaches . https   newsfinale com local news red tide alert issued for sarasota pinellas area beaches",2024-11-18 14:50:14,"en","1686542285641551872",FALSE,"everyone","1858523112003752429","1858523112003752429",FALSE,"2023-08-02T01:00:00.000Z","NewsfinalePub","Newsfinale Journal",NA,NA,FALSE,"","https://pbs.twimg.com/profile_images/1686542460900532224/JWKuQOLG_normal.jpg",NA,0,0,0,0,0,9,42,79,18047,0,17,NA,"Red tide alert issued for Sarasota, Pinellas area beaches https://t.co/nONKQjzHwi",NA,FALSE,NA
"24","🌊The red tide organism Karenia brevis was detected in 74 samples collected from SW #Florida. Bloom concentrations were observed: 1 off Pinellas, 1 in Hillsborough and Manatee, 5 in Sarasota, 2 in and offshore of Charlotte, and 1 in Lee Counties. #Poison Help 1-800-222-1222. . https   x com FloridaPoison status 1858511226453594535 video 1",2024-11-18 14:03:00,"en","236390420",FALSE,"everyone","1858511226453594535","1858511226453594535",FALSE,"2011-01-10T13:44:51.000Z","FloridaPoison","FL Poison Control","Florida, USA","https://t.co/JPynmUPoh3",FALSE,"Florida's Poison Control Centers provide free, confidential help with poisoning emergencies 24/7/365 @ 1-800-222-1222. RTs/follows/favorites ≠ endorsement","https://pbs.twimg.com/profile_images/798194714281316352/nEcHrPCl_normal.jpg",NA,0,0,0,0,0,54,1205,428,10397,21,2595,NA,"🌊The red tide organism Karenia brevis was detected in 74 samples collected from SW #Florida. Bloom concentrations were observed: 1 off Pinellas, 1 in Hillsborough and Manatee, 5 in Sarasota, 2 in and offshore of Charlotte, and 1 in Lee Counties. #Poison Help 1-800-222-1222. https://t.co/KiXqzbTBxy",NA,FALSE,NA
"25","RT @wusf: Heavier concentrations were found at several beaches in Pinellas, Manatee and Sarasota counties.
. https   www wusf org environment 2024 11 15 red tide on march along beaches pinellas manatee sarasota",2024-11-18 13:08:18,"en","377666632",FALSE,"everyone","1858497461175865758","1858497461175865758",FALSE,"2011-09-21T22:53:34.000Z","radiocraigkopp","Craig Kopp","Land O Lakes, Florida",NA,FALSE,"Radio man, Podcast man, Writer man","https://pbs.twimg.com/profile_images/1490711932650889217/kLsdYtt5_normal.jpg",NA,3,0,0,0,0,0,1094,1529,43305,52,40020,NA,"RT @wusf: Heavier concentrations were found at several beaches in Pinellas, Manatee and Sarasota counties.
https://t.co/vDAZ18YSHQ",NA,FALSE,NA
